tweet,Topic_0,Topic_1,Topic_2,Dominant_Topic,Perc_Dominant_Topic
democratic governor defy biden come tyrannical mandate,0.914978563785553,0.04217514395713806,0.042846277356147766,Topic 0,0.91
hear,0.16945244371891022,0.6551522016525269,0.17539535462856293,Topic 1,0.66
maybe,0.16684049367904663,0.6614919900894165,0.17166751623153687,Topic 1,0.66
take time body build protection people consider fully week second week single dose amp,0.12893323600292206,0.8449357748031616,0.02613093890249729,Topic 1,0.84
job pay week preppe body resistance requirement get work mandate,0.03558063879609108,0.929042637348175,0.03537674993276596,Topic 1,0.93
happen join cult magical fail badly damage healthy people,0.9192086458206177,0.046403173357248306,0.034388214349746704,Topic 0,0.92
talk source post follow reddit find post screenshot people antivaxx compliance get die even though would,0.020802265033125877,0.9569077491760254,0.02228999137878418,Topic 1,0.96
object spiritual belief take case docket result,0.060657162219285965,0.4113399386405945,0.528002917766571,Topic 2,0.53
risk co worker customer die nonetheless anti put risk want last forever,0.20976850390434265,0.7617892026901245,0.028442295268177986,Topic 1,0.76
regular work level datum around decade datum actual risk kid cat,0.030359769240021706,0.9394217133522034,0.030218493193387985,Topic 1,0.94
worldwide issue politic impacting ability perspective,0.049318064004182816,0.9019184112548828,0.04876353219151497,Topic 1,0.9
good reminder young healthy people die preventable disease former high ridge dy local news,0.7599669098854065,0.023749062791466713,0.21628403663635254,Topic 0,0.76
relate death reporting decline available booster shot approve uptake parity race let,0.026614319533109665,0.02661212533712387,0.9467735886573792,Topic 2,0.95
even number almost likely cause heart issue prevent serious case boy leave aside injury poisoning kid assuage,0.01960116997361183,0.9608817100524902,0.01951715350151062,Topic 1,0.96
contract major manufacturer,0.08558633178472519,0.09024924039840698,0.8241644501686096,Topic 2,0.82
convert change mail,0.09224777668714523,0.3532790541648865,0.5544732213020325,Topic 2,0.55
careful take precaution know get rare breakthrough recommend also long,0.03333123028278351,0.4552982449531555,0.5113704800605774,Topic 2,0.51
case follow day protest anti government rally climate sweep,0.037257544696331024,0.9223672747612,0.04037516564130783,Topic 1,0.92
travel restriction upend life relax new rule go effect allow air travel previously restrict country long traveler proof,0.021412495523691177,0.24014736711978912,0.7384400963783264,Topic 2,0.74
plenty doctor advise risk procedure surgery doctor tell seriously consider adverse effect get doctor single one say,0.9528287053108215,0.024663839489221573,0.022507430985569954,Topic 0,0.95
almost friend get booster catch week work spread virus,0.03603914752602577,0.4371379017829895,0.5268229246139526,Topic 2,0.53
want information hear need go pick wide variety answer,0.48179876804351807,0.48218977451324463,0.036011435091495514,Topic 1,0.48
child become fully adult mandate develop decade ever suspect would potentially become pandemic,0.21651175618171692,0.7548201680183411,0.02866811491549015,Topic 1,0.75
worried think clown worried steroid side_effect especially regard brain,0.930037260055542,0.03580150380730629,0.034161243587732315,Topic 0,0.93
get political kind country use program brainwash kid old even know significance government,0.03250033035874367,0.9348514080047607,0.03264822065830231,Topic 1,0.93
study show child need,0.07610475271940231,0.07630790024995804,0.8475873470306396,Topic 2,0.85
never say literally illustrate counterpoint doctor prevention strategy low rate completely obliterate,0.02957284264266491,0.033155541867017746,0.9372715950012207,Topic 2,0.94
answer question prevent recipient get answer mean ineffective ineffective assertion safety also false,0.7999348044395447,0.16906914114952087,0.030996054410934448,Topic 0,0.8
interesting believe people concern deadly history weed ever kill many people datum,0.0273410864174366,0.9408157467842102,0.03184317424893379,Topic 1,0.94
rally call develop herd immunity world gradually open incl bar hard liquor property,0.025986090302467346,0.09711058437824249,0.8769033551216125,Topic 2,0.88
give people take much tv time people take guess people get sick dramatic tv anti vaxxer protest get,0.16823098063468933,0.8099108934402466,0.021858148276805878,Topic 1,0.81
would take chance rather lose child unfortunately lose son year ago bad pain ever know,0.20388267934322357,0.6145927906036377,0.18152457475662231,Topic 1,0.61
prevent get hell people get time,0.049496524035930634,0.8992782235145569,0.051225244998931885,Topic 1,0.9
still catch sprea get shoot mean reason shoot mean also mean definition,0.02796943113207817,0.24702276289463043,0.7250077724456787,Topic 2,0.73
supply people deliver get fire forth would cause damage think next time tell get work,0.023945260792970657,0.9539945721626282,0.022060155868530273,Topic 1,0.95
national crisis mandating make sense drug comparison show legal common people fire let go similar reason say,0.958859384059906,0.02154945395886898,0.019591137766838074,Topic 0,0.96
even know work make clear would know mmr shoot believe,0.032130323350429535,0.9359582662582397,0.03191140666604042,Topic 1,0.94
risk vast majority people vast majority people healthy early people peak physical condition rely body make living name pro athlete,0.01921420358121395,0.9636503458023071,0.017135491594672203,Topic 1,0.96
devastating however mean good,0.06950406730175018,0.07335564494132996,0.8571402430534363,Topic 2,0.86
get remember patient avian flu,0.06449883431196213,0.06173184886574745,0.8737693428993225,Topic 2,0.87
recover child unnecessarily lose parent deputy recover change mind,0.036131322383880615,0.7455455660820007,0.21832308173179626,Topic 1,0.75
people make medical decision nonsense rodger basically chance die,0.9269846677780151,0.03714083880186081,0.03587447106838226,Topic 0,0.93
certain vaccination work staff want shout public call also public test,0.03033914975821972,0.033673688769340515,0.935987114906311,Topic 2,0.94
squander recovery inherit broken system real plan escalate death infection unemployment rate problem fact ronna,0.3869316875934601,0.5040680766105652,0.10900021344423294,Topic 1,0.5
receive already report induce support idea phenomenon regardless mechanism action,0.04684171825647354,0.03150270879268646,0.921655535697937,Topic 2,0.92
suspend account comment happen share life experience okay,0.04076505824923515,0.03883102536201477,0.9204039573669434,Topic 2,0.92
get refuse expose know many people let team,0.04013435170054436,0.42152896523475647,0.5383366942405701,Topic 2,0.54
case today produce first year biden even recover job produce djt lose pandemic least produce new job biden increase price,0.15708711743354797,0.7622125744819641,0.0807003304362297,Topic 1,0.76
die adverse reaction tell shoot legitimate reason question reliability gene therapy vac,0.03074081428349018,0.9338371753692627,0.03542201966047287,Topic 1,0.93
virus build immunity,0.0856466293334961,0.8226500153541565,0.0917033851146698,Topic 1,0.82
put risk understand virus work obviously person still spread,0.036683209240436554,0.040797214955091476,0.9225195646286011,Topic 2,0.92
high rate world case surge,0.059998057782649994,0.06813457608222961,0.8718674182891846,Topic 2,0.87
city world lockdown number world top get complacent maori,0.034539058804512024,0.03651510551571846,0.9289458394050598,Topic 2,0.93
give honest answer question would disappear fast people would voluntarily vaccinate scientist learn first option peace,0.6832782030105591,0.1132950633764267,0.20342673361301422,Topic 0,0.68
think nee start distribute sniper,0.0781450942158699,0.06262169778347015,0.8592332601547241,Topic 2,0.86
appoint judge temporarily halt mandate private business,0.9159077405929565,0.041989877820014954,0.042102374136447906,Topic 0,0.92
get virus work truth protein toxin actually low immune response primary activator nurse get day booster,0.02700870670378208,0.02247081696987152,0.9505205154418945,Topic 2,0.95
quite opposite polio time shoot disease eliminate virus keep add booster even,0.16181044280529022,0.050410196185112,0.7877793312072754,Topic 2,0.79
infection rate strict policy come passport testing face mask policy work,0.6256005764007568,0.02945791743695736,0.34494152665138245,Topic 0,0.63
go cure detail obviously ignorance show show anywhere close smallpox polio,0.038292378187179565,0.9314154386520386,0.030292149633169174,Topic 1,0.93
many folk die die overwhelmed hospital low rent chickenhawk need family die pandemic cluck low info,0.02421868033707142,0.9447735548019409,0.031007738783955574,Topic 1,0.94
know expect break situation perfectly voice far reach completely change people talk think cov,0.32749587297439575,0.6472482085227966,0.025255892425775528,Topic 1,0.65
get drive,0.11379054188728333,0.7695591449737549,0.11665036529302597,Topic 1,0.77
good person think care people die favor population get,0.5154346227645874,0.44304248690605164,0.04152290150523186,Topic 0,0.52
mandate temporarily block court cnet,0.8872585892677307,0.056392207741737366,0.056349217891693115,Topic 0,0.89
issue requirement child,0.20824125409126282,0.12341779470443726,0.6683409214019775,Topic 2,0.67
shoot sore arm high fever body soon panic real time booster update yesterday night fatigue body mild compa,0.02327836863696575,0.02164175733923912,0.9550798535346985,Topic 2,0.96
lose battle endless variant risk benefit worth healthy people,0.6208638548851013,0.04092263802886009,0.3382135033607483,Topic 0,0.62
tell also grateful mild case bitch tell protect immunization shoot,0.03493298590183258,0.6696181297302246,0.295448899269104,Topic 1,0.67
injure,0.16713054478168488,0.6658145785331726,0.16705484688282013,Topic 1,0.67
receive arena surprised efficiency nurse give information need opportunity ask question obtain consent sore arm feel bit tired day second,0.06747295707464218,0.01670248992741108,0.9158245921134949,Topic 2,0.92
right break prior definition allow people claim,0.044145647436380386,0.9137306213378906,0.042123738676309586,Topic 1,0.91
uneducated idiotic full fear simply afraid child get infect even tho,0.14493407309055328,0.40195050835609436,0.45311543345451355,Topic 2,0.45
also look say great people still catch die talk shit make want put face wall smarter,0.26698392629623413,0.7111361622810364,0.02187996357679367,Topic 1,0.71
risk get outweigh risk get,0.05769612640142441,0.06873854994773865,0.8735653758049011,Topic 2,0.87
apply admittance stadium also many type restaurant bar store long matter,0.033458832651376724,0.40402477979660034,0.5625163912773132,Topic 2,0.56
variant adolescent,0.11198867112398148,0.11259575188159943,0.7754155993461609,Topic 2,0.78
protect many vaxed people get anyways even disturbing,0.045224182307720184,0.9145439267158508,0.04023194685578346,Topic 1,0.91
people need natural_immunity infection risk injury still get virus probably would recover,0.027808232232928276,0.8009896874427795,0.17120212316513062,Topic 1,0.8
course flu much high efficacy target develop severe case prevent infection first place flu shot well,0.022824764251708984,0.09018637984991074,0.8869888782501221,Topic 2,0.89
simple look inoculation remember survival rate,0.8987849950790405,0.05088738352060318,0.05032764747738838,Topic 0,0.9
know effect know effect,0.07498664408922195,0.42797940969467163,0.4970339238643646,Topic 2,0.5
approximately victim suffer linger health effect many seriously pfe pill prevent effect need,0.6092748641967773,0.3617991507053375,0.02892601303756237,Topic 0,0.61
get today hear parent share mixed emotion age group allow get,0.028683708980679512,0.2034013420343399,0.7679149508476257,Topic 2,0.77
really month later get help force work,0.046502213925123215,0.9084171652793884,0.04508059844374657,Topic 1,0.91
change remove immunity,0.09020273387432098,0.8258994817733765,0.08389776945114136,Topic 1,0.83
organization try save life spokesman spout rubbish lie suppo,0.038388337939977646,0.037755466997623444,0.9238561987876892,Topic 2,0.92
report trial investigate contract company,0.6795893907546997,0.06075184792280197,0.2596588134765625,Topic 0,0.68
personal experience antibody reexpose numerous time reinfecte magic amazing adaptive key,0.029648305848240852,0.9404715299606323,0.029880203306674957,Topic 1,0.94
break campaign senior advisor reveal impose state wide mandate election go election,0.3456645905971527,0.027138585224747658,0.6271967887878418,Topic 2,0.63
actually prove call normal even virus ingredient shoot design harm help,0.029080595821142197,0.33772510290145874,0.6331943273544312,Topic 2,0.63
right people act statistic say otherwise small rural county low rate trump fertile ground disease,0.07182354480028152,0.07895448058843613,0.8492220044136047,Topic 2,0.85
bogus card confront illegal seller,0.05748074874281883,0.05841684341430664,0.8841024041175842,Topic 2,0.88
well get bird flu hear bird,0.04844299331307411,0.8957512974739075,0.05580572038888931,Topic 1,0.9
get knew symptom stand home hot well know sick make mild,0.030262582004070282,0.30517077445983887,0.664566695690155,Topic 2,0.66
different make different way different stuff,0.9001365303993225,0.05068339407444,0.049180082976818085,Topic 0,0.9
,0.3333333432674408,0.3333333432674408,0.3333333432674408,Topic 0,0.33
put policy place official proof state cover benefit take free buy hospi,0.9381902813911438,0.03256634622812271,0.029243336990475655,Topic 0,0.94
tell mom want think willing help let turn still lie bitch come excuse say could forget sign fuck,0.34131067991256714,0.6387842893600464,0.01990497298538685,Topic 1,0.64
mandate private employer deal major blow,0.4539574086666107,0.04963691905140877,0.496405690908432,Topic 2,0.5
could post study study stupid sttment increase rollout imply cause increase really look fact study,0.615405261516571,0.027966564521193504,0.3566281497478485,Topic 0,0.62
tyranny dictatorship livelihood dependent get shoot personal decision biden mandate responsibility fight country mandate bad economy,0.22177360951900482,0.7560402750968933,0.022186171263456345,Topic 1,0.76
exactly dangerous idea passport lead argue ban unvaccinated public space world time,0.5246036648750305,0.02819954603910446,0.4471967816352844,Topic 0,0.52
know suffer long list side_effect take call,0.04466734081506729,0.8823181986808777,0.07301446050405502,Topic 1,0.88
mean never go get still die,0.05353688448667526,0.8902413249015808,0.056221820414066315,Topic 1,0.89
guess kill fast trample fake card put much,0.04405660554766655,0.044904857873916626,0.9110385775566101,Topic 2,0.91
people die yesterday probably wish mandate,0.8837563395500183,0.06142363324761391,0.05482001230120659,Topic 0,0.88
right nearly rate actually likely cause dopey,0.050463855266571045,0.17295855283737183,0.7765775918960571,Topic 2,0.78
let speak liberal endanger child time likely die hospitalize,0.15910734236240387,0.03562873229384422,0.805263876914978,Topic 2,0.81
probably already overwhelming amount need study counting proving natural_immunity follow science,0.6043868660926819,0.3494163453578949,0.04619675129652023,Topic 0,0.6
surveillance perverse incentive testing child,0.058362364768981934,0.8036293387413025,0.13800834119319916,Topic 1,0.8
natural_immunity provide fully immunize,0.836368203163147,0.08997812867164612,0.07365371286869049,Topic 0,0.84
love fear cult even strange bunch,0.16958178579807281,0.782492995262146,0.0479251854121685,Topic 1,0.78
boy get today listen droid know,0.05339614301919937,0.8778492212295532,0.06875458359718323,Topic 1,0.88
also need mess antibody count even organ body function need,0.03364589810371399,0.9325622916221619,0.03379184380173683,Topic 1,0.93
infection injury,0.11255642026662827,0.44863611459732056,0.43880748748779297,Topic 1,0.45
run nightly unchallenged complain make kid feel safe absolutely get,0.13436013460159302,0.5226654410362244,0.3429744243621826,Topic 1,0.52
technology use develop treat vih remember correctly go step testing rush sense,0.9379319548606873,0.027132932096719742,0.034935109317302704,Topic 0,0.94
face fraud charge role deceive customer effectiveness accuse falsify datum pay large bribe still trust science,0.02292926050722599,0.9561184644699097,0.02095230668783188,Topic 1,0.96
think drop people dead spot,0.5946876406669617,0.34826013445854187,0.05705221742391586,Topic 0,0.59
science also say natural_immunity strong amp reliable science say history thrombosis take thing strengthen clotti,0.5647938251495361,0.41344019770622253,0.02176598273217678,Topic 0,0.56
case state still record digit number rate grow news ago well vaccinate virus rate still climb seem problem,0.34360772371292114,0.022182127460837364,0.6342101097106934,Topic 2,0.63
die complication go become bucket,0.06037640571594238,0.8811019062995911,0.05852169916033745,Topic 1,0.88
partner stop buy family conspiracy theory get first hugely proud,0.21995191276073456,0.03355896845459938,0.7464891672134399,Topic 2,0.75
pathetic news network hurt viewer bad advertise kid,0.04136727377772331,0.9198771119117737,0.0387556254863739,Topic 1,0.92
thing go really wrong work sue government approve,0.04639820381999016,0.28687942028045654,0.6667224168777466,Topic 2,0.67
stand people insidious highly infectious airborne virus call keep lot safe become widely available,0.02424764446914196,0.10024494677782059,0.8755074143409729,Topic 2,0.88
recommend amount responsible thing want people aware ready get booster bit heavy second dose chill lethargic,0.020191818475723267,0.4925732910633087,0.4872349202632904,Topic 1,0.49
regardless status prevent severe disease old obese comorbiditie take young healthy think take,0.2039952278137207,0.38207992911338806,0.41392481327056885,Topic 2,0.41
make people throw fit get look even silly good big_bird company,0.03373568505048752,0.9356827735900879,0.030581509694457054,Topic 1,0.94
believe good defense also firmly believe make healthcare decision base good family,0.940995991230011,0.030467040836811066,0.028536969795823097,Topic 0,0.94
watch people actually get shoot nurse put hand arm get shoot shoot fake publicity stunt even good case photoshoppe flu,0.016392238438129425,0.9639460444450378,0.01966167613863945,Topic 1,0.96
issue requirement child reuter,0.433457612991333,0.07444009929895401,0.4921022653579712,Topic 2,0.49
people go court rule private business mandate,0.9086647629737854,0.047856561839580536,0.04347865656018257,Topic 0,0.91
note operate full capacity require proof pair valid photo access screening event visit blog info safety update,0.5580719709396362,0.019111406058073044,0.42281660437583923,Topic 0,0.56
fully functional brain see info come nearly side_effect single milder version,0.6458544731140137,0.31392163038253784,0.040223877876996994,Topic 0,0.65
anti flat earther green bay quarterback seek alternative treatment instead,0.9362320303916931,0.03249287232756615,0.03127507492899895,Topic 0,0.94
stop get stay home,0.11585930734872818,0.07304581254720688,0.8110948801040649,Topic 2,0.81
know even experimental fully test fully approve mainstream treatment treatment long,0.029186297208070755,0.938171923160553,0.03264179825782776,Topic 1,0.94
find measle effective developed urgency hard compare term check friend mom know,0.03528677672147751,0.215620756149292,0.7490924596786499,Topic 2,0.75
let mention fact number higher last year,0.6235926747322083,0.32863494753837585,0.0477723702788353,Topic 0,0.62
brilliant plan infect way say replace injection injection actually make sense think buck guess,0.9408462643623352,0.02660991996526718,0.032543815672397614,Topic 0,0.94
ever age must side_effect notice conspicuously put metal object,0.0435187965631485,0.2058381885290146,0.7506430149078369,Topic 2,0.75
become available small child want give kid asthma never sometimes thing othe,0.09916906803846359,0.46654218435287476,0.43428874015808105,Topic 1,0.47
make perfect sense approach,0.859322190284729,0.07217291742563248,0.06850486248731613,Topic 0,0.86
depend get personal immune assume already fairly similar context immune response study,0.6987902522087097,0.027354639023542404,0.273855060338974,Topic 0,0.7
understand virus shoot small seasonal shoot mandate,0.046211354434490204,0.044731706380844116,0.9090569615364075,Topic 2,0.91
metric endemic metric end indoor mask mandate pass negative effect policy medium demanding answer,0.5524471402168274,0.022886166349053383,0.42466670274734497,Topic 0,0.55
immunization use loosely technically count immunization make immune infection decrease chance catch treatment booster therapy,0.023428792133927345,0.023088548332452774,0.9534826278686523,Topic 2,0.95
comment stand speak right take help recover quickly people truth take work,0.49138039350509644,0.48089364171028137,0.027725957334041595,Topic 0,0.49
difficult nurse object receive due religious belief take case literally process take case,0.1993473768234253,0.4496021866798401,0.3510504364967346,Topic 1,0.45
line never say bleach think disinfectant work could nice would look treatment,0.02936195395886898,0.935675323009491,0.0349627286195755,Topic 1,0.94
care people get want tell business tell people,0.2369769811630249,0.724349319934845,0.038673680275678635,Topic 1,0.72
child receive first,0.08386000245809555,0.0839422345161438,0.8321977853775024,Topic 2,0.83
think hurry report trial investigate contract company,0.6015432476997375,0.0451274998486042,0.35332927107810974,Topic 0,0.6
rodger seek treatment instead cite allergy,0.893418550491333,0.05265112593770027,0.05393034964799881,Topic 0,0.89
say state give child age give green light,0.703776478767395,0.04175646975636482,0.25446707010269165,Topic 0,0.7
get today wing feel little sore give body extra protective boost keep healthy would throw garbage great,0.9549885392189026,0.022235795855522156,0.02277565561234951,Topic 0,0.95
true experience long lasting harm similar damage expect preventable disease measle dead significant,0.026561515405774117,0.3309941291809082,0.642444372177124,Topic 2,0.64
lie exactly status public knowledge entire time big deal get recover day,0.03159764036536217,0.6790375113487244,0.28936484456062317,Topic 1,0.68
let hope next aaron_rodger drop health comment,0.9072373509407043,0.04472546651959419,0.04803718999028206,Topic 0,0.91
agree position comfortable lying status,0.05987673997879028,0.4086769223213196,0.5314463376998901,Topic 2,0.53
datum fake era light,0.07329995930194855,0.8586487174034119,0.06805133074522018,Topic 1,0.86
get bingo card,0.08683332800865173,0.823098361492157,0.09006829559803009,Topic 1,0.82
antivaxxer agenda post get mean pro always ask care vaxxe care ask say everywhere,0.024775490164756775,0.9503551721572876,0.024869341403245926,Topic 1,0.95
main provider already overwork underpaid staff reach break point many,0.6995739936828613,0.03620665892958641,0.26421937346458435,Topic 0,0.7
trend twitter tweet get first dose kid age learn today would treat respect civility social medium,0.021077033132314682,0.02140064164996147,0.9575223922729492,Topic 2,0.96
prayer protect child amp wake,0.06311801075935364,0.05926806852221489,0.8776139616966248,Topic 2,0.88
receive,0.1681710183620453,0.16674740612506866,0.6650815606117249,Topic 2,0.67
even number almost likely cause heart issue prevent serious case boy leave aside injury poison kid assuage terror,0.018493512645363808,0.9630838632583618,0.018422631546854973,Topic 1,0.96
study find report usually mild moderate test flu amp shot,0.032610367983579636,0.032853927463293076,0.9345356822013855,Topic 2,0.93
federal_appeal_court freeze rule company,0.8561897277832031,0.07426067441701889,0.06954959034919739,Topic 0,0.86
science recover immunity need recover still consider unvaxxed require observe rule make,0.028809208422899246,0.9365061521530151,0.034684620797634125,Topic 1,0.94
realize used help sow chaos people follow comment,0.7004411220550537,0.25977879762649536,0.039780113846063614,Topic 0,0.7
already metastasie persuade public health provide primary care pharmacy immunize targeted support,0.9443649649620056,0.027316641062498093,0.02831837348639965,Topic 0,0.94
injure feel abandon government tell shoot safe children health defense,0.3636023998260498,0.60132896900177,0.03506867215037346,Topic 1,0.6
lie status lie doctor tell prevent get mean homeopathic doctor,0.0333329513669014,0.9341949224472046,0.03247210010886192,Topic 1,0.93
injury,0.16674932837486267,0.6665074825286865,0.1667432337999344,Topic 1,0.67
keep introduce school affect kid attend private school mask mandate place use child political pawn,0.8689655065536499,0.024387028068304062,0.10664749145507812,Topic 0,0.87
accord recent study likely die infection vaxxe roughly statistical difference career int rate aaron_rodger mitch trubisky,0.022963572293519974,0.02021772600710392,0.956818699836731,Topic 2,0.96
add testing know measure feed family would trust,0.04991864785552025,0.9099305868148804,0.04015079140663147,Topic 1,0.91
,0.3333333432674408,0.3333333432674408,0.3333333432674408,Topic 0,0.33
nope decade provide true immunity even decade get prevent spread symptom spread,0.02714350074529648,0.9455355405807495,0.0273209810256958,Topic 1,0.95
additional offer certain group person begin next week divulge information update,0.4711177945137024,0.029840558767318726,0.4990416169166565,Topic 2,0.5
get ill basically people pre survive give child company create seek assurance hold account,0.35159119963645935,0.02807452902197838,0.620334267616272,Topic 2,0.62
disenrolle student class comply university requirement,0.047768861055374146,0.04883132502436638,0.9033998250961304,Topic 2,0.9
