tweet,Topic_0,Topic_1,Topic_2,Dominant_Topic,Perc_Dominant_Topic
kid bird alike get,0.0685712993144989,0.8604028224945068,0.07102587074041367,Topic 1,0.86
forget get bad boy waiting room interested,0.05052190646529198,0.9068053960800171,0.042672716081142426,Topic 1,0.91
risk severe illness hospitalization death far high risk even healthy people close,0.3489205539226532,0.03660544753074646,0.6144739985466003,Topic 2,0.61
scientist testify panel ask approve,0.05780019611120224,0.880330502986908,0.061869338154792786,Topic 1,0.88
really get conspiracy theory know infection mask,0.04400046542286873,0.054671648889780045,0.9013278484344482,Topic 2,0.9
child age thus flip side record death result update,0.3113144338130951,0.1318650245666504,0.5568205714225769,Topic 2,0.56
apparently ode people anti people could start rumor kill ppl take,0.5852809548377991,0.3830200433731079,0.03169896453619003,Topic 0,0.59
start today select group high risk individual book booster dose appointment portal call provincial contact centre eligible individual also book directly select clinic,0.2587975561618805,0.014482265338301659,0.7267202138900757,Topic 2,0.73
mean know side_effect drug inject body,0.540486752986908,0.4081001877784729,0.05141311138868332,Topic 0,0.54
seriously take medical advice think smarter aaron_rodger give wild anti interview catch,0.943385124206543,0.0291441660374403,0.027470724657177925,Topic 0,0.94
lot also stand criticism disadvantaged people clinic inconvenient place option proper,0.8924620747566223,0.02959943749010563,0.0779384896159172,Topic 0,0.89
let straight death many want see multiple death get,0.03666695952415466,0.04523075371980667,0.9181023240089417,Topic 2,0.92
,0.3333333432674408,0.3333333432674408,0.3333333432674408,Topic 0,0.33
exciting permission family share student receive today mom tell want wear shirt special event,0.02455100603401661,0.25275754928588867,0.7226914167404175,Topic 2,0.72
usual woman always support woman man always wrong woman always right look story friend break soon husband find impotent,0.9536272287368774,0.0189073383808136,0.027465498074889183,Topic 0,0.95
case hospitalization death circulate forever expose well help exposure occur,0.4538349211215973,0.35003313422203064,0.19613194465637207,Topic 0,0.45
bit perplexed write stupid really get seriously ask help protect still spread,0.13223418593406677,0.2623354494571686,0.6054303646087646,Topic 2,0.61
finally get appointment little,0.8184828758239746,0.08842659741640091,0.09309058636426926,Topic 0,0.82
puppet get get really sick,0.06808413565158844,0.5799089074134827,0.3520069420337677,Topic 1,0.58
dispute target former football coach mandate public employee,0.9158968329429626,0.04078851267695427,0.04331464320421219,Topic 0,0.92
read court order halt mandate private employer,0.9152771234512329,0.042490147054195404,0.042232707142829895,Topic 0,0.92
know people fall category get available die get still get wait category people die get,0.022190207615494728,0.9550893902778625,0.022720424458384514,Topic 1,0.96
get politic comply government fact support mandate get want fully aware possible survive,0.030312858521938324,0.9438303709030151,0.0258567463606596,Topic 1,0.94
bad contract major manufacturer,0.10450852662324905,0.08423849940299988,0.8112529516220093,Topic 2,0.81
question state get week appointment go also scottish status app unable booster sign,0.8196533918380737,0.029065672308206558,0.15128090977668762,Topic 0,0.82
give already mutate variant,0.6146917343139648,0.06838615238666534,0.3169220983982086,Topic 0,0.61
care get rate would make related coverage available free charge instead look monetise pandemic cool,0.02430214174091816,0.9524322152137756,0.02326565608382225,Topic 1,0.95
ask well lie reason country worry bully great job bully ppl news flash stay forever flu,0.4765654504299164,0.24561429023742676,0.27782025933265686,Topic 0,0.48
deadly depopulation agenda cover,0.06871200352907181,0.8643088936805725,0.06697911769151688,Topic 1,0.86
comment,0.1761242151260376,0.2083473652601242,0.615528404712677,Topic 2,0.62
big bad researcher blow whistle integrity issue pfizer trial revelation poor practice contract research company,0.7897073030471802,0.0220089852809906,0.1882837563753128,Topic 0,0.79
offer incentive kid age get,0.06479480862617493,0.35325008630752563,0.5819551348686218,Topic 2,0.58
get first case last summer long first second bout think get thought wait get first,0.024539165198802948,0.6802855134010315,0.29517534375190735,Topic 1,0.68
uncomfortable ready cry imagine horror inflict human body especially underlying condition,0.22942529618740082,0.0892900601029396,0.6812846660614014,Topic 2,0.68
confirm appointment pharmacist tell line give busy poor planning system suck,0.37382403016090393,0.029437284916639328,0.5967386960983276,Topic 2,0.6
break prior definition allow people claim,0.05040908232331276,0.9015519618988037,0.04803900420665741,Topic 1,0.9
party big favor stop talk mask make sense thing know,0.03734331950545311,0.20624247193336487,0.7564142346382141,Topic 2,0.76
risk talk risk talk benefit rational question benefit outweigh risk evidence say,0.03026769310235977,0.036216624081134796,0.9335156679153442,Topic 2,0.93
imagine think get dangerous play professional football,0.6485304832458496,0.3066386282444,0.04483084753155708,Topic 0,0.65
take approve take lie make sense comment,0.050802115350961685,0.9032253623008728,0.045972563326358795,Topic 1,0.9
grateful get appointment today drive hour get start finish process take minute post wait,0.027622386813163757,0.9458733797073364,0.026504231616854668,Topic 1,0.95
week coach tell get happy make really happy,0.043826624751091,0.9162871241569519,0.03988626226782799,Topic 1,0.92
available late grandma country allow heart condition end get son husband currently life support amp make past tonight,0.02124052122235298,0.6377353668212891,0.34102413058280945,Topic 1,0.64
mask work stay home sick risk severe start treat flu,0.03466068208217621,0.03202488273382187,0.9333144426345825,Topic 2,0.93
keep die plenty good enough,0.06466047465801239,0.8740596175193787,0.061279892921447754,Topic 1,0.87
maybe unvaccinate non employee happen nazi hospital want many ontario hospital instituting absence mail,0.02384655550122261,0.02749621868133545,0.948657214641571,Topic 2,0.95
screaming exist damn,0.7968732118606567,0.11209015548229218,0.0910365954041481,Topic 0,0.8
question work instead people get still efficient case question government recommend take responsibility,0.02648443728685379,0.8450181484222412,0.12849737703800201,Topic 1,0.85
study month,0.12485702335834503,0.12970826029777527,0.7454347014427185,Topic 2,0.75
former network,0.4412834048271179,0.44655120372772217,0.1121654361486435,Topic 1,0.45
blame shoot scare people resist helpful promote feed anyway,0.0340612418949604,0.9256948828697205,0.040243878960609436,Topic 1,0.93
choice choice freedom freewill pill need mandate,0.5450078248977661,0.40720266103744507,0.047789499163627625,Topic 0,0.55
back mia damn month allergic reaction feel good back create content,0.11568580567836761,0.031308870762586594,0.8530053496360779,Topic 2,0.85
book immortality far behind,0.07185954600572586,0.8235796689987183,0.10456082224845886,Topic 1,0.82
perfectly healthy contract suffered month amp die type death well underlie problem highly,0.2494249939918518,0.02972562052309513,0.7208493947982788,Topic 2,0.72
doubt reaction wonder underlie issue long post adverse reaction still rare clearly help sorry struggle wishing,0.02042366750538349,0.6820046305656433,0.29757174849510193,Topic 1,0.68
study concluding recover people may harmed take recover,0.04133061319589615,0.7292079329490662,0.2294614613056183,Topic 1,0.73
accord vaer report death state death death combine last year percent,0.9392000436782837,0.029493778944015503,0.03130617365241051,Topic 0,0.94
whole extended family sweden get rollout include mother hope work start upset,0.8162944912910461,0.029183099046349525,0.15452241897583008,Topic 0,0.82
originate say week ago need antibody amp cell hold well work variant far,0.02576984278857708,0.6246135234832764,0.3496165871620178,Topic 1,0.62
thank give long period life,0.8567488789558411,0.06837258487939835,0.0748785212635994,Topic 0,0.86
tomorrow brave advocate take effort hand,0.7544557452201843,0.19404307007789612,0.05150122568011284,Topic 0,0.75
country close fully partially need concerned year true logic tell work even concern surely eventually,0.022557934746146202,0.9529754519462585,0.024466652423143387,Topic 1,0.95
break rule must avoid cost cancel universal good news waar waar,0.9409121870994568,0.030014216899871826,0.02907359041273594,Topic 0,0.94
world,0.18207640945911407,0.16685962677001953,0.6510639786720276,Topic 2,0.65
able go emergency room rule still place asshole twerp goddamne afraid would mean think,0.29159584641456604,0.6848627328872681,0.023541433736681938,Topic 1,0.68
get today wing feel little sore give body extra protective boost keep healthy even say get little bird,0.8142799735069275,0.16404561698436737,0.021674400195479393,Topic 0,0.81
danger give false protection people vac symptom danger society,0.7680429220199585,0.19478975236415863,0.03716728836297989,Topic 0,0.77
go skepticism,0.1207963228225708,0.7609628438949585,0.1182408556342125,Topic 1,0.76
hide house give freedom protect effective preventing natural_immunity educate stop,0.9326826930046082,0.03145980462431908,0.035857487469911575,Topic 0,0.93
worried put body problem take,0.45757386088371277,0.48254308104515076,0.05988306552171707,Topic 1,0.48
parent go share input year_old thank,0.6742591857910156,0.054963599890470505,0.2707771956920624,Topic 0,0.67
remember speech meet charity fundraising agree game yet make public,0.859460175037384,0.1083701029419899,0.032169703394174576,Topic 0,0.86
real detriment fence important program seriously listen dumb still ready die early moron,0.20933718979358673,0.07427306473255157,0.7163897752761841,Topic 2,0.72
course temporarily halt nationwide implementation mandate company worker,0.6368860602378845,0.06766968220472336,0.2954442501068115,Topic 0,0.64
damn straight thing change mind take natural_immunity many study confirm may harmful recovered people study,0.47396668791770935,0.1610412448644638,0.36499208211898804,Topic 0,0.47
time child approval,0.08581631630659103,0.08893018960952759,0.8252534866333008,Topic 2,0.83
happen world become overpopulated mass authority probably elite try depopulate many,0.7441451549530029,0.21429987251758575,0.041554950177669525,Topic 0,0.74
block administration late mandate give government response,0.6671038269996643,0.28847748041152954,0.04441864416003227,Topic 0,0.67
copy result proof full required attend must also comply commitment,0.034600891172885895,0.03107810579240322,0.9343210458755493,Topic 2,0.93
already receive let see,0.07318184524774551,0.06741704046726227,0.8594011068344116,Topic 2,0.86
child adolescent,0.11204815655946732,0.11265648901462555,0.7752953171730042,Topic 2,0.78
bag majority icu similar result hide deny long go openly report still people wil,0.02625146321952343,0.37590575218200684,0.597842812538147,Topic 2,0.6
true never meet padraig hoping fully recover last bout recurrence seriously get,0.030571699142456055,0.9429486989974976,0.026479551568627357,Topic 1,0.94
unfortunately blame die stroke must hit car driver hide watch,0.9352213144302368,0.03378663212060928,0.030992060899734497,Topic 0,0.94
block biden,0.7758356928825378,0.11300279945135117,0.11116152256727219,Topic 0,0.78
start title people continue get also know rodger symptom test positive comment study impact,0.023821726441383362,0.7287930846214294,0.2473851889371872,Topic 1,0.73
anti vaxer go refuse go rationale refuse relatively new know test adequately,0.5395234227180481,0.10088568180799484,0.35959091782569885,Topic 0,0.54
think due wane effectiveness worry uptick community take seriously,0.1955486387014389,0.7706047892570496,0.033846575766801834,Topic 1,0.77
exclusive say injury far bad cancer diane year_old cancer diagnose inflammatory demyelinating polyneuropathy second pfizer,0.023964030668139458,0.7379940748214722,0.23804190754890442,Topic 1,0.74
receive today first day make available child age approve,0.03616677224636078,0.03711138665676117,0.9267218112945557,Topic 2,0.93
stand,0.6268944144248962,0.18158921599388123,0.19151641428470612,Topic 0,0.63
cherry pick datum apparently twice deadly secondly comment hood wink public believe valid variant lastly proble,0.020957838743925095,0.956430971622467,0.022611144930124283,Topic 1,0.96
death due actually report vaer pay attention also suppose prevent hospitalization death people still die,0.38651248812675476,0.20052173733711243,0.4129658043384552,Topic 2,0.41
say would fine get say even preventative prevent wish people would quit say,0.03061494417488575,0.9434554576873779,0.025929607450962067,Topic 1,0.94
work extremely well keep hospital keep die likely news new pull head sand,0.5739270448684692,0.027832549065351486,0.3982403874397278,Topic 0,0.57
skepticism,0.16754332184791565,0.6650270223617554,0.16742967069149017,Topic 1,0.67
die year brother excruciate month month ask,0.05800606682896614,0.05221550166606903,0.8897784352302551,Topic 2,0.89
several liberal life say anti people deserve die deny healthcare going fill resentment type attitude liberal lose,0.05765395611524582,0.23253418505191803,0.7098118662834167,Topic 2,0.71
help symptom far well stupid,0.05713634192943573,0.8773890137672424,0.06547468900680542,Topic 1,0.88
today last day deliver month tomorrow mark chapter district continue protect people western sydney,0.024068504571914673,0.9477176070213318,0.028213901445269585,Topic 1,0.95
always know smarter quarterback,0.07610557228326797,0.856429934501648,0.06746447086334229,Topic 1,0.86
court freeze company,0.8275769948959351,0.08452193439006805,0.08790109306573868,Topic 0,0.83
post black licorice flavor hot dog obviously fake amp equally obvious joke amp put temporary ban explanation people may think true meanwhile kind amp,0.015370369888842106,0.01655842922627926,0.9680712223052979,Topic 2,0.97
,0.3333333432674408,0.3333333432674408,0.3333333432674408,Topic 0,0.33
safe ever give people worldwide serious amp keep die serious illness even get,0.2193395048379898,0.6746580600738525,0.10600249469280243,Topic 1,0.67
juror dismiss rittenhouse trial shoot kid new federal requirement,0.1466393917798996,0.8126953840255737,0.040665242820978165,Topic 1,0.81
funny report people die afraid,0.061690181493759155,0.4147675931453705,0.5235422253608704,Topic 2,0.52
get anymore actually people super spreader get even know go spread get keep get,0.023750482127070427,0.9520400762557983,0.024209434166550636,Topic 1,0.95
come high uptake county high rate enlighten wise one,0.036750733852386475,0.03362997621297836,0.9296192526817322,Topic 2,0.93
source tell,0.11852604895830154,0.7627381086349487,0.1187358871102333,Topic 1,0.76
ask join month ago remove restriction mask social distancing rule,0.5161197185516357,0.038397494703531265,0.4454827904701233,Topic 0,0.52
still hesitant nzer unaware impact need awareness message reach need hear,0.47641173005104065,0.4926905930042267,0.030897710472345352,Topic 1,0.49
assert still face grave danger virus,0.8873685002326965,0.056113265454769135,0.056518230587244034,Topic 0,0.89
require age plenty lose job take even thing hospital want require employee choose fate foll,0.022136380895972252,0.6654114723205566,0.31245213747024536,Topic 1,0.67
statement personally know several people get catch husband husband die wife recover happen several peop,0.7371144890785217,0.23754234611988068,0.025343194603919983,Topic 0,0.74
seem follow proper protocol give weird thing happen also hear inject area weird stuff,0.9490689635276794,0.02728455886244774,0.023646477609872818,Topic 0,0.95
get walk appointment thank,0.09002164006233215,0.8415886759757996,0.06838960945606232,Topic 1,0.84
antibody treatment medication stop conformity stand different serious,0.9013584852218628,0.05662199854850769,0.04201951250433922,Topic 0,0.9
die complication claiming kill people test positive purchase aim travel protest healthcare genocide,0.025585683062672615,0.9476934671401978,0.026720808818936348,Topic 1,0.95
death hit record low rate,0.8733160495758057,0.058515943586826324,0.06816801428794861,Topic 0,0.87
guess,0.17062540352344513,0.17217688262462616,0.6571977138519287,Topic 2,0.66
get first today modern science amazing,0.048792824149131775,0.43838995695114136,0.5128172039985657,Topic 2,0.51
safe general population milk government use sponsor ad big milk propaganda,0.9169647097587585,0.050807856023311615,0.03222740814089775,Topic 0,0.92
effect case continue rise,0.07153355330228806,0.461555153131485,0.46691128611564636,Topic 2,0.47
get go teach public health let gay teacher go,0.7502899169921875,0.21090756356716156,0.038802482187747955,Topic 0,0.75
would good job half country get people force measle school country place force stil,0.023982370272278786,0.947503924369812,0.028513677418231964,Topic 1,0.95
fully take allow get virus transmit get shoot stuff hope,0.18666088581085205,0.7803149819374084,0.0330241322517395,Topic 1,0.78
docket potentially expose record accord research docket app enable individual download carry digital copy record,0.9556589126586914,0.02151508629322052,0.022826023399829865,Topic 0,0.96
year_old daughter eligible eligible flu shot get flu shot yesterday tear happy get try offer lollipop,0.021518757566809654,0.021148059517145157,0.9573332071304321,Topic 2,0.96
,0.3333333432674408,0.3333333432674408,0.3333333432674408,Topic 0,0.33
family bed week tell good work,0.054863058030605316,0.894890308380127,0.050246648490428925,Topic 1,0.89
must listen use word stop positive state,0.8954910635948181,0.04895450547337532,0.05555439740419388,Topic 0,0.9
least people die abruptly people diagnose cancer terminal cancer month dump end crematorium face disaster tell big lie,0.019865436479449272,0.9387922883033752,0.041342318058013916,Topic 1,0.94
people fully enough people feel safe get,0.29168760776519775,0.6616047620773315,0.046707633882761,Topic 1,0.66
rly seem test unvaccinated natural_immunity superior risk mycocarditis,0.7291215658187866,0.044076401740312576,0.2268020510673523,Topic 0,0.73
think year combine report datum,0.8702908158302307,0.06224161386489868,0.067467600107193,Topic 0,0.87
diagnose open,0.1114121749997139,0.11196260154247284,0.7766252756118774,Topic 2,0.78
get first get flu shot win win arm little sore gamer handle,0.026388855651021004,0.027320116758346558,0.9462910294532776,Topic 2,0.95
stop people get mean transmit mostly mean still get sick transmit clarity,0.02739701233804226,0.4229692816734314,0.5496336817741394,Topic 2,0.55
imagine say talk carry bat get,0.050023630261421204,0.8982590436935425,0.05171726644039154,Topic 1,0.9
wane immunity happen get still transmit even people need learn live flu go away anyt,0.024899719282984734,0.9502727389335632,0.024827517569065094,Topic 1,0.95
skepticism,0.16755051910877228,0.665015459060669,0.16743402183055878,Topic 1,0.67
people know special fund exist pay claim injury death,0.035130877047777176,0.9297369718551636,0.035132117569446564,Topic 1,0.93
get first shot today glad finally make point,0.05463022366166115,0.0430867038667202,0.9022830724716187,Topic 2,0.9
lie status public knowledge entire know team know know become big deal get day,0.02362685278058052,0.7781819701194763,0.19819116592407227,Topic 1,0.78
list hard understand new tech kill stop trial start human human trial month,0.6668147444725037,0.026865150779485703,0.30632010102272034,Topic 0,0.67
make news forgetting think people lose life week year get wear mask,0.5683066844940186,0.06332606077194214,0.3683672845363617,Topic 0,0.57
block mandate large business cowardly republican death freedom fighter cause people die refuse accept responsibility kill charge try murder,0.721314549446106,0.25540482997894287,0.02328064851462841,Topic 0,0.72
spur good response people colitis,0.8695695996284485,0.06764445453882217,0.06278593093156815,Topic 0,0.87
thought take proof proof,0.5461227297782898,0.08182959258556366,0.37204763293266296,Topic 0,0.55
union fight,0.13392427563667297,0.7529094815254211,0.11316622793674469,Topic 1,0.75
false prophet declare morally acceptable necessary great good sacred duty come folk,0.3287399411201477,0.643541693687439,0.027718374505639076,Topic 1,0.64
still trust snake oil thinking would cure scare much much baby scare needle,0.024758534505963326,0.9494448900222778,0.02579658292233944,Topic 1,0.95
exist bias last procedure dose even obvious symptom stare face issue,0.03032919578254223,0.9380993247032166,0.03157150000333786,Topic 1,0.94
work must show card enter business playin,0.9071343541145325,0.046277254819869995,0.046588409692049026,Topic 0,0.91
would bird need,0.08447347581386566,0.8275455832481384,0.08798098564147949,Topic 1,0.83
young people time likely die know possibly even make furious medium lie help big cost life child,0.024032697081565857,0.34843766689300537,0.6275296807289124,Topic 2,0.63
inform die due complication,0.5954799652099609,0.33558326959609985,0.06893672049045563,Topic 0,0.6
poor thing sheep lead former charge research say child dy die result take wake people,0.6167697906494141,0.12528415024280548,0.25794604420661926,Topic 0,0.62
know sible live twin city approximately white die complication prior hospitalize recover hospital low oxygen get remdesivir bad,0.01866961643099785,0.8121072053909302,0.16922320425510406,Topic 1,0.81
never think second misinformation campaign suddenly interested probably way would hope alone,0.13308261334896088,0.6018908619880676,0.2650265097618103,Topic 1,0.6
view current topic cover sure people get reason main one put else risk film get,0.02377915568649769,0.7155337929725647,0.260686993598938,Topic 1,0.72
say replace agree cyanide able agree bad government want pas cyanide mandatory would able,0.023305753245949745,0.9537991285324097,0.022895099595189095,Topic 1,0.95
sad may memory blessing sound family die issue statement,0.9301337003707886,0.0350508950650692,0.03481536731123924,Topic 0,0.93
lie get believe much feeling lie say get lied put danger fire drop sponsor,0.6026170253753662,0.372459352016449,0.02492365427315235,Topic 0,0.6
believe character show teaching kid well people would tell kid life saving prevent long get science,0.021512838080525398,0.9557909965515137,0.02269611693918705,Topic 1,0.96
spread end mandate,0.11169655621051788,0.09154611080884933,0.7967573404312134,Topic 2,0.8
forget survive suffer kind complication understand want guinea pig,0.03591884672641754,0.9275703430175781,0.03651084378361702,Topic 1,0.93
chance adverse vaer stat great chance die age adverse side_effect due,0.7947818040847778,0.03185403719544411,0.17336419224739075,Topic 0,0.79
care abt death side_effect death fraud,0.05885503068566322,0.8880875110626221,0.05305742472410202,Topic 1,0.89
long,0.18314388394355774,0.6236046552658081,0.19325146079063416,Topic 1,0.62
part explanation,0.11179382354021072,0.11169974505901337,0.7765064835548401,Topic 2,0.78
mandate temporarily block court,0.8645063042640686,0.06778072565793991,0.06771297007799149,Topic 0,0.86
new figure week show co waterford high rate high incidence rate,0.939016580581665,0.02955636940896511,0.03142702952027321,Topic 0,0.94
aaron_rodger catch lie status go rant nfl policy misjudge situation likely severely punish try right thing global pandemic,0.9567418694496155,0.02365969680249691,0.019598407670855522,Topic 0,0.96
furthermore due failure health system bureaucracy care patient ongoing health issue cancer comorbiditie related result see culmination heal,0.8934670090675354,0.01944272592663765,0.08709031343460083,Topic 0,0.89
learn memetic interlude well worth read link thread worthy know even asymptomatic mild pwn ground mad prop,0.021612435579299927,0.02539646439254284,0.9529910683631897,Topic 2,0.95
prevent people get establish debate need mandate good help recover,0.034319985657930374,0.9330329895019531,0.03264699876308441,Topic 1,0.93
trump shy fall type blame effective vaxxe still catch spread die,0.21963368356227875,0.2363090068101883,0.544057309627533,Topic 2,0.54
access medical record golly let know fair long allergy base complicate infecti,0.8489919304847717,0.12206698209047318,0.028941109776496887,Topic 0,0.85
get first shot today great yet sore arm eye say uplink complete kid really say darned thing cute,0.22002868354320526,0.02314934879541397,0.7568219900131226,Topic 2,0.76
give still pose threat people online blend course option still remain viable option student university remain flexible regard person online course take,0.6451312899589539,0.01561548002064228,0.3392532467842102,Topic 0,0.65
century case man many people mandate even people adverse effect amp death nonexistent,0.03252705559134483,0.9349271655082703,0.03254580497741699,Topic 1,0.93
nationwide strike,0.7767141461372375,0.11152667552232742,0.11175922304391861,Topic 0,0.78
aaron_rodger life healthy lifestyle exercise amp eat nutrient dense precisely manage mild symptom dedication amp fitness make ideal spokesperson fire,0.029226558282971382,0.9519448280334473,0.01882859878242016,Topic 1,0.95
league packer aware status also team wide outbreak,0.09220343083143234,0.8690763711929321,0.03872014209628105,Topic 1,0.87
let test experimental child,0.06976838409900665,0.07371895015239716,0.8565126657485962,Topic 2,0.86
mentally stable exist want pretty much get want problem,0.03428439050912857,0.4844120442867279,0.4813036024570465,Topic 1,0.48
get great way stay healthy rubbish brainwash kid,0.9059340357780457,0.048932190984487534,0.04513382166624069,Topic 0,0.91
